ID;Tag;Kategória;Štúdium;Autor;Otázka;Obmena 1;Obmena 2;Obmena 3;Obmena 4;Odpoveď 1;Odpoveď 2;Odpoveď 3
29;;Akademický rok;BID;JO;Kedy je začiatok akademického roku?;Kedy začína akademický rok?;Aký je dátum začiatku akademického roka?;Kedy je termín začiatku školského roka?;Kedy začína školský rok?;Začiatok akademického roku 2022/23 je 1.9.2022;Odpoveď je možné nájsť na linku: https://www.fri.uniza.sk/calendar?year=2022&section=E;
30;;Akademický rok;BID;JO;Kedy je koniec akademického roku?;Kedy končí akademický rok?;Aký je dátum konca akademického roka?;Kedy je termín konca školského roka?;Kedy končí školský rok?;Koniec akademického roku 2022/23 je 31.8.2023;Odpoveď je možné nájsť na linku: https://www.fri.uniza.sk/calendar?year=2022&section=E;
19;;Akcie;BID;JO, JK, AP;Aké akcie je možné nájsť na FRI počas roku?;Sú na FRI študentské akcie?;Aké sú možnosti kultúrneho vyžitia študentov?;Aké akcie sa dejú na FRI?;Aké sú voľnočasové aktivity na FRI? ;Ako študent na FRI máte prístup k mnohým študentským akciam ako napríklad Fričkovica, FRI ples, FRI punč a mnoho ďalších.;Akcie ako Fričkovica, FRI ples by vas mohli zaújmať.;
20;;Akcie;BID;JO, AP;Čo je to FRIčkovica?;Čo za podujatie je FRIčkovica?;Čo sa robí na FRIčkovici?;Ako prebieha fričkovica?;Čo sa deje na fričkovici?;Jesenné podujatie kde je občerstvenie a ako aj možnosť sa porozprávať so spolužiakmi a inými zaujmavimi ľudmi;;
21;;Akcie;BID;JO;Čo je to IT Trhovisko?;Čo za podujatie je IT Trhovisko?;Čo sa robí na IT Trhovisku?;Ako prebieha it trhovisko?;Čo sa deje na it trhovisku?;Prezentácia firiem ktoré by mali záujem o budúcu spoluprácu so študentami.;;
40;;Akcie;BID;JO, AP;Kedy je deň otvorených dverí?;Kedy sa koná Deň otvorených dverí? ;Aký je dátum DOD?;Kedy je termín dňa otvorených dverí?;Kedy je DOD?;Ďen otverných dveri v roku 2021/22 bol dňa 17.2.2022, dátum pre rok 2022/23 ešte nebol rozhodnutý.;;
169;;Akcie;;JO;Má FRI deň otvorených dverí?;Má FRI DOD?;Koná sa na FRI DOD?;Býva na fakulte deň otvorených dverí?;Koná sa na fakulte deň ptvorených dverí?;Áno.;;
170;;Akcie;;JO, AP;Čo je to panel story?;Čo za podujatie je panel story?;Čo sa robí na panel story?;Ako prebieha panel story?;Čo sa deje na panel strory?;Prezentácia študentských projektov pre verejnosť.;;
252;;Akcie;;JK;Chodí sa vrámci fakulty na spoločný výlet?;Je možnosť ísť na spoločný výlet vrámci fakulty?;Bývajú na FRI výlety?;Sú na fakulte spoločné výlety?;Dá sa ísť na FRI na výlet?;Áno.;;
432;;Akcie;;AP;Čo je to FRI ples?;Čo za podujatie je FRI ples?;Čo sa robí na FRI plese?;Ako prebieha ples?;Čo sa deje plese fakulty?;Ples organizovaný fakultou FRI pre študentov.;;
403;;Dekanát;;AP;Kto je dekan?;Aké je meno dekana fakulty?;Ako sa volá dekan?;Meno dekana?;Priezvisko dekana?;doc. Ing. Emil Kršák, PhD;;
404;;Dekanát;;AP;Kto je prodekan pre vzdelávanie?;Aké je meno prodekana pre vzdelávanie?;Ako sa volá prodekan pre vzdelávanie?;Meno prodekana pre vzdelávanie?;Priezvisko prodekana pre vzdelávanie?;doc. Ing. Viliam Lendel, PhD;;
405;;Dekanát;;AP;Kto je prodekan pre vedu a výskum?;Aké je meno prodekana pre vedu a výskum?;Ako sa volá prodekan pre vedu a výskum?;Kto má na starosti vedu a výskum?;Meno prodekana pre vedu a výskum?;doc. Ing. Michal Koháni, PhD;;
406;;Dekanát;;AP;Kto je prodekan pre zahraničné vzťahy?;Aké je meno prodekana pre zahraničné vzťahy?;Ako sa volá prodekan pre zahraničné vzťahy?;Kto má na starosti zahraničné vzťahy?;Meno prodekana pre zahraničné vzťahy?;doc. Ing. Peter Márton, PhD;;
168;;Erazmus;;JO;Je možné sa na FRI zapojiť do programu Erasmus? ;Dá sa ísť na ERAZMUS?;Môžem ísť na ERAZMUS?;;;Áno, bližšie informácie je možné nájsť na linku: https://www.fri.uniza.sk/stranka/aktualne-informacie-erasmus;;
191;;Erazmus;;JK, AP;Koho mám kontaktovať ak chcem vycestovať v rámci študentského programu erazmus?;Kto mi pomôže s ERAZMUS+?;Kto má na starosti ERAZMUS?;;;doc. Ing. Peter Márton, PhD;;
287;;Erazmus;;JK, AP;Aké možnosti Erasmu ponúka FRI?;Aké sú možnosti ERAZMU?;;;;FRI ponúka možnosť íst viac krát na erasmus ale celková doba na erasme nemôže presiahnúť 1 rok. ;Študenti môžu ísť aj počast zimného aj letného semestra na erasmus.;
144;;Internát;;JO;Kde sa nachádzajú internáty?;Kde sú internáty?;Kde sú intráky?;Kde nájdem internát?;;Adresa pre internát velký diel: Žilinská univerzita, Ubytovacie Zariadenie Veľký Diel Vysokoškolákov 20 010 08 Žilina. Adresa pre internát hliny: ulica, Hlinská, 010 01 Žilina.;Adresy môžete nájsť na linku: https://www.iklub.sk/?q=ubytko;
77;;ISIC;;JO;Kde dostanem preukaz študenta?;Kde dostanem ISIC?;Kde mi vydajú ISIC?;Kde mi vydajú preukaz študenta?;;Preukaz si môžete vyzdvihnúť na rektoráte.;;
78;;ISIC;;JO;Kedy dostanem preukaz študenta?;Kedy dostanem ISIC?;;;;Od septembra je potrebné si zaplatiť za ISIC a následne si ho budete môcť vyzdvihnúť;;
79;;ISIC;;JO, AP;Aký vysoký je poplatok za preukaz študenta?;Koľko stojí ISIC?;Koľko stojí preukaz študenta?;Koľko sa platí za ISIC?;Koľko sa platí za preukaz študenta?;Cena záleží od požiadaviek študenta.;;
126;;ISIC;;JO;Je možné používať kartu ISIC aj v MHD?;Môžem cestovať s ISIC aj v MHD?;;;;Áno.;Do veku 26 je možné využívať ISIC v MHD.;
127;;ISIC;;JO;Je možné používať kartu ISIC v SAD?;Môžem cestovať s ISIC aj v SAD?;;;;Áno.;Do veku 26 je možné využívať ISIC v SAD.;
128;;ISIC;;JO;Je možné používať kartu ISIC vo vlaku?;Môžem cestovať s ISIC aj vlakom?;;;;Áno.;Do veku 26 je možné využívať ISIC vo vlaku.;
158;;ISIC;;JO, JK;Kde je možné znovu aktivovať preukaz ISIC?;Kde si môžem aktivovať ISIC kartu?;;;;Na stránke e-many a následne na rektoráte.;;
159;;ISIC;;JO;Je možné znovu aktivovať preukat ISIC?;Môžem si predľžiť  platnosť ISIC?;;;;Áno.;;
179;;ISIC;;JK;Kde si môžem predĺžiť ISIC kartu? ;Kde viem predĺžiť ISIC?;Kde mi predĺžia platnosť ISIC?;;;Na stránke e-many a následne na rektoráte.;;
306;;ISIC;;JK;Pomýlil som sa pri vypisovaní ISIC údajov, je možné ich zmeniť?;Viem zmeniť údaje, ktoré som zadal do ISIC? ;Kde zmením údaje na ISIC?;;;Áno. ;;
307;;ISIC;;JK;Je možné chodiť na fri aj bez ISIC karty?;;;;;Nepravdepodobne.;Nie.;
308;;ISIC;;JK;Ak nemám predĺženú ISIC kartu, je možné chodiť do školy?;;;;;Možné to je ale nie odporúčané.;Mal by si si ísť predĺžiť ISIC inak nebudeš mať prístup k funkciam ISICu.;
399;;ISIC;;AP;Kde si vybavím ISIC?;;;;;Na stránke e-many a následne na rektoráte.;;
400;;ISIC;;AP;Do kedy je možné predĺžiť si ISIC?;;;;;Do konca školského roka.;;
59;;Katedra;BID;JO;Aké katedry sa nachádzajú na FRI?;Aké ma FRI katedry?;;;;Informačných sietí, Informatiky, Makro a microekonomiky, Manažérskych teórií, Matematických metód a operačnej analýzy, Softvérových technológií a Technickej kybernetiky.;;
60;;Katedra;BID;JO;Kde nájdem katedru informatiky?;Kde je katedra informatiky?;Kde sa nachádza katedra informatiky?;Kde je KI?;Kde nájdem KI?;Vedúceho prof. Vitaly Levashenko, PhD. nájdeš v miestnosti RA204, v danej blízkosti je celá katedra.;;
61;;Katedra;BID;JO;Kde nájdem katedru informačných sietí?;Kde je katedra informačných sietí?;Kde sa nachádza katedra informačných sietí?;Kde je KIS?;Kde nájdem KIS?;Vedúceho doc. Pavel Segeč, PhD. nájdeš v miestnosti RB354, v danej blízkosti je celá katedra.;;
62;;Katedra;BID;JO;Kde nájdem katedru makro a mikroekonomiky?;Kde je katedra makro a mikroekonomiky?;Kde sa nachádza katedra makro a mikroekonomiky?;Kde je KMME?;Kde nájdem KMME?;Vedúceho doc. Ing. Mária Ďurišová, PhD. nájdeš v miestnosti RB204, v danej blízkosti je celá katedra.;;
63;;Katedra;BID;JO;Kde nájdem katedru matematických metód a operačnej analýze?;Kde je katedra matematických metód a operačnej analýze?;Kde sa nachádza katedra matematických metód a operačnej analýze?;Kde je frdsa?;Kde nájdem FRDSA?;Vedúceho prof. Ing. Ľudmila Jánošíková, PhD. nájdeš v miestnosti RA226, v danej blízkosti je celá katedra.;;
64;;Katedra;BID;JO;Kde nájdem katedru manažerských teórií?;Kde je katedra manažerských teórií?;Kde sa nachádza katedra manažerských teórií?;Kde je KMNT?;Kde nájdem KMNT?;Vedúceho prof. Ing. Milan Kubina, PhD. nájdeš v miestnosti RB252, v danej blízkosti je celá katedra.;;
65;;Katedra;BID;JO;Kde nájdem katedru softvérových technológií;Kde je katedra softvérových technológií;Kde sa nachádza katedra softvérových technológií;Kde je KST?;Kde nájdem KST?;Vedúceho Ing. Viliam Tavač, PhD. nájdeš v miestnosti RB120, v danej blízkosti je celá katedra.;;
66;;Katedra;BID;JO;Kde nájdem katedru technickej kybernetiky?;Kde je katedra technickej kybernetiky?;Kde sa nachádza katedra technickej kybernetiky?;Kde je FRTK?;Kde nájdem FRTK?;Vedúceho prof. Ing. Peter Ševčík, PhD. nájdeš v miestnosti RB111, v danej blízkosti je celá katedra.;;
1;;Kredity;B;JO, AP;Aký je minimálny počet kreditov na opakovanie prvého ročníka bakalárskeho štúdia?;Koľko kreditov potrebujem na zápis do rovnakého ročníka v prvom ročníku na bakalarskom štúdiu?;;;;20 kreditov;;
2;;Kredity;B;JO, AP;Aký je minimálny počet kreditov na opakovanie druhého ročníka bakalárskeho štúdia?;Koľko kreditov potrebujem na zápis do rovnakého ročníka v druhom ročníku  na bakalarskom štúdiu?;;;;60 kreditov;;
3;;Kredity;B;JO, AP;Aký je minimálny počet kreditov na opakovanie tretieho ročníka bakalárskeho štúdia?;Koľko kreditov potrebujem na zápis do rovnakého ročníka v treťom ročníku  na bakalarskom štúdiu?;;;;100 kreditov;;
4;;Kredity;B;JO, AP;Koľko kreditov potrebujem pri študijnom programe Informatika z povinne voliteľných predmetov?;Aký je minimálny počet kreditov za povinne voliteľné predmety v študijnom programe informatika?;;;;15 kreditov;;
5;;Kredity;B;JO, AP;Koľko kreditov potrebujem pri študijnom programe Manažment z povinne voliteľných predmetov?;Aký je minimálny počet kreditov za povinne voliteľné predmety v študijnom programe manažment?;;;;20 kreditov;;
6;;Kredity;B, I;JO, AP;Koľko kreditov potrebujem pri študijnom programe Počítačové inžinierstvo z povinne voliteľných predmetov?;Aký je minimálny počet kreditov za povinne voliteľné predmety v študijnom programe počítačové inžinierstvo?;;;;15 kreditov;;
7;;Kredity;B;JO;Aký je odporúčaný počet kreditov na opakovanie prvého ročníka bakalárskeho štúdia?;;;;;Minimálny počet kreditov na opakovanie prvého ročníka je 20;;
8;;Kredity;B;JO;Aký je odporúčaný počet kreditov na opakovanie druhého ročníka bakalárskeho štúdia?;;;;;Minimálny počet kreditov na opakovanie druhého ročníka je 60;;
9;;Kredity;B;JO, AP;Aký je minimálny počet kreditov na uzavretie bakalárskeho štúdia?;Koľko kreditov potrebujem na ukončenie bakalárskeho štúdia?;;;;180 kreditov;;
185;;Kredity;;JK;Koľko kreditov potrebujem pre opätovné zapísanie do toho istého ročníka?;;;;;Záleží od aktuálneho ročníka;;
186;;Kredity;;JK;Koľko kreditov potrebujem pre zapísanie do vyššieho ročníka?;;;;;Záleží od aktuálneho ročníka;;
187;;Kredity;;JK;Koľko kreditov potrebujem pre uzatvorenie štúdia?;;;;;Záleží od aktuálneho ročníka;;
209;;Kredity;;JK;Sú nutné kredity aj z volitelných predmetov?;;;;;Nie sú povinné, ale odporúčame si zapisovať aj voliteľné predmety pre dostatok kreditov;;
371;;Kredity;;AP;Koľko kreditov potrebujem na zápis do vyššieho ročníka v prvom ročníku na bakalarskom štúdiu?;Aký je minimálny počet kreditov na zápis do vyššieho ročníka v prvom ročníku bakalárskeho štúdia?;;;;40 kreditov;;
372;;Kredity;;AP;Koľko kreditov potrebujem na zápis do vyššieho ročníka v druhom ročníku  na bakalarskom štúdiu?;Aký je minimálny počet kreditov na zápis do vyššieho ročníka v druhom ročníku bakalárskeho štúdia?;;;;80 kreditov;;
376;;Kredity;;AP;Koľko kreditov potrebujem na ukončenie inžinierského štúdia?;Aký je minimály počet kreditov na ukončenie inžinierského štúdia?;;;;120 kreditov.;Tak akurát.;
377;;Kredity;I;AP;Aký je minimálny počet kreditov za povinne voliteľné predmety v študijnom programe informačné systémy?;Koľko kreditov potrebujem za povinne voliteľné predmety v študijnom programe informačné systémy?;;;;15 kreditov.;;
378;;Kredity;I;AP;Aký je minimálny počet kreditov za povinne voliteľné predmety v študijnom programe informačný manažment?;Koľko kreditov potrebujem za povinne voliteľné predmety v študijnom programe informačný manažment?;;;;15 kreditov.;;
379;;Kredity;I, D;AP;Aký je minimálny počet kreditov za povinne voliteľné predmety v študijnom programe inteligentné informačné systémy?;Koľko kreditov potrebujem za povinne voliteľné predmety v študijnom programe inteligentné informačné systémy?;;;;15 kreditov.;;
380;;Kredity;I;AP;Aký je minimálny počet kreditov za povinne voliteľné predmety v študijnom programe aplikované sieťové inžinierstvo?;Koľko kreditov potrebujem za povinne voliteľné predmety v študijnom programe aplikované sieťové inžinierstvo?;;;;15 kreditov.;;
381;;Kredity;D;AP;Aký je minimálny počet kreditov za povinne voliteľné predmety v študijnom programe aplikovaná informatika?;Koľko kreditov potrebujem za povinne voliteľné predmety v študijnom programe aplikovaná informatika?;;;;15 kreditov.;;
382;;Kredity;D;AP;Aký je minimálny počet kreditov za povinne voliteľné predmety v študijnom programe manažment?;Aký je minimálny počet kreditov za povinne voliteľné predmety v študijnom programe manažment?;;;;15 kreditov.;;
80;;Miestnosť;;JO, JK;Kde nájdem študíjny referát?;Kde sa nachádza štúdijný referát?;;;;RA111.;Prvé poschodie a potom doľava.;
104;;Miestnosť;;JO;Ako je možné zarezervovať si miestnosť?;Ako si viem rezervovať miestnosť?;;;;Pôjdete na stránku https://www.fri.uniza.sk/schoolrooms/reservations.;;
105;;Miestnosť;;JO;Kde nájdem rezerváciu miestností?;;;;;Na stránke https://www.fri.uniza.sk/schoolrooms/reservations.;;
190;;Miestnosť;;JK;Chcem ísť za pánom prodekanom. V ktorej miestnosti by som ho vedel nájsť? ;Kde nájdem pána prodekana?;;;;RA102.;Tam kde sa nachádza.;
43;;O škole;BID;JO, AP;V aký rok vznikla FRI?;Kedy vznikla FRI?;;;;11.7.1990;;
44;;O škole;BID;JO, AP;V aký rok vznikla UNIZA?;Kedy vznikla UNIZA?;;;;10.1.1953;;
92;;O škole;;JO;Aká je webová stránka UNIZA?;;;;;https://www.uniza.sk;;
93;;O škole;;JO;Aká je webová stránka FRI?;;;;;https://www.fri.uniza.sk;;
112;;O škole;;JK, JO;Viem niekde nájsť plány budovy?;Kde nájdem mapu FRI?;;;;;Vieš?;
305;;O škole;;JK;Aká je presná adresa FRI?;;;;;Univerzitná 8215/1, 010 26 Žilina;;
392;;O škole;;AP;Čo znamená skratka FRI?;;;;;Fakulta riadenia a informatiky;;
139;;Poplatky;;JO, JK;Aká je výška poplatku za prihlášku?;Je za prihlášku na štúdium poplatok?;Koľko stojí nová prihláška?;;;20 €;;
141;;Poplatky;;JO;Na aký účet je potrebné odoslať poplatok za prihlášku?;;;;;SK96 8180 0000 0070 0026 9909;;
441;;Poplatky;;AP;Koľko stojí internát?;;;;;41-61€ mesačne;;
129;;Prax;;JO, AP;Je možné absolvovať predmet prax na fakulte?;Môžem absolvovať prax aj na fakulte?;;;;Áno, je tu možnosť využitia fakultnej praxe.;;
130;;Prax;;JO;Koľko je minimálny počet hodín praxe?;Koľko hodín praxe musím absolvovať?;Koľko hodín praxe musím odpracovať?;;;150 hodín;;
339;;Štipendium;;JK;Aká je maximálna možná suma tehotenského štipendia?;Koľko je maximálna suma tehotenského štipendia?;Aká je horná hranica tehotenského štipendia?;Aká suma je hornou hranicou tehotenského štipendia?;Aká je najvyššia suma tehotenského štipendia?;"Výška tehotenského štipendia je 200 eur mesačne. Vláda môže ustanoviť nariadením inú
výšku tehotenského štipendia. ";;
340;;Štipendium;;JK;Ako môžem získať tehotenské štipendium?;Ako je možné získať tehotenské štipendium?;V ako prípade môžem získať tehotenské štipendium?;Čo musím robiť aby som získal tehotenské štipendium?;Aké sú kroky ku získaniu tehotenské štipendia?;https://www.uniza.sk/images/pdf/stipendia/tehotenske/30032021_Postup-pri-podani-ziadosti-o-tehotenske-stipendium.pdf;;
393;;Štipendium;;AP;Aké sú podmienky získania štipendia?;Aké podmienky musím spĺňat pre získanie štipendia?;Ktoré podmienky sú nutné pre získanie štipendia?;Aké sú nutné podmienky pre získanie štipendia?;Akými podmienkami sú podmienené štipendiá?;;;
10;;Študijné programy;I;JO;Aké sú inžinierské študíjne programy?;Aké inžinierské študijné programy sú na FRI?;Aké inžinierské odbory sú na FRI?;Ktoré inžinierské študíjne programy existujú na FRI?;Ktoré inžinierské odbory existujú na FRI?;"Informačné systémy, Inteligentné informačné systémy, Biomedicínska informatika, Aplikované sieťové inžinierstvo, Informačný manažment, Počítačové inžinierstvo
Viac info tu:  https://www.fri.uniza.sk/stranka/ponukane-inzinierske-studijne-programy";;
11;;Študijné programy;B;JO;Aké sú bakalárske študíjne programy?;Aké bakalárske študijné programy sú na FRI?;Aké bakalárske odbory sú na FRI?;Ktoré bakalárske študíjne programy existujú na FRI?;Ktoré bakalárske odbory existujú na FRI?;"Informatika, Informatika a riadenie, Informačné a sieťové technológie, Manažment, Počítačové inžinierstvo
Viac info tu: https://www.fri.uniza.sk/stranka/ponukane-bakalarske-studijne-programy";;
12;;Študijné programy;D;JO;Aké sú doktorantské študíjne programy?;Aké doktorantské študijné programy sú na FRI?;Aké doktorantské odbory sú na FRI?;Ktoré doktorantské študíjne programy existujú na FRI?;Ktoré doktorantské odbory existujú na FRI?;Aplikovaná informatika, Manažment, Inteligentné informačné systémy;;
48;;Študijné programy;;JO;O čom je program Informatika?;Čo sa vyučuje v programe Informatika?;Čo sa vyučuje v odbore Informatika?;Aký je popis študíjneho programu Informatika?;Aký je popis odboru Informatika?;O bakalárskych študijných programoch sú informácie na nasledovnom linku: https://www.fri.uniza.sk/stranka/ponukane-bakalarske-studijne-programy;;
49;;Študijné programy;;JO;O čom je program Manažment?;Čo sa vyučuje v programe Manažment?;Čo sa vyučuje v odbore Manažment?;Aký je popis študíjneho programu Manažment?;Aký je popis odboru Manažment?;O bakalárskych študijných programoch sú informácie na nasledovnom linku: https://www.fri.uniza.sk/stranka/ponukane-bakalarske-studijne-programy;;
50;;Študijné programy;;JO;O čom je program Počítačové Inžinierstvo?;Čo sa vyučuje v programe Počítačové Inžinierstvo?;Čo sa vyučuje v odbore Počítačové Inžinierstvo?;Aký je popis študíjneho programu Počítačové Inžinierstvo?;Aký je popis odboru Počítačové Inžinierstvo?;O bakalárskych študijných programoch sú informácie na nasledovnom linku: https://www.fri.uniza.sk/stranka/ponukane-bakalarske-studijne-programy;;
51;;Študijné programy;;JO;O čom je program Biomedicínske inžinierstvo?;Čo sa vyučuje v programe Biomedicínske inžinierstvo?;Čo sa vyučuje v odbore Biomedicínske inžinierstvo?;Aký je popis študíjneho programu Biomedicínske inžinierstvo?;Aký je popis odboru Biomedicínske inžinierstvo?;https://youtu.be/DuV7m2yiCdU;;
52;;Študijné programy;;JO;O čom je program Inteligentné informačné systémy?;Čo sa vyučuje v programe Inteligentné informačné systémy?;Čo sa vyučuje v odbore Inteligentné informačné systémy?;Aký je popis študíjneho programu Inteligentné informačné systémy?;Aký je popis odboru Inteligentné informačné systémy?;https://youtu.be/zim6Sf3Rqjc;;
56;;Študijné programy;;JO;O čom je program Informačné systémy?;Čo sa vyučuje v programe Informačné systémy?;Čo sa vyučuje v odbore Informačné systémy?;Aký je popis študíjneho programu Informačné systémy?;Aký je popis odboru Informačné systémy?;"Informačné systémy - zameranie spracovanie dát:
https://youtu.be/iHhVYllG3j4
Informačné systémy - zameranie grafické spracovanie dát:
https://youtu.be/eN-xqn6fRVs
Informačné systémy - zameranie podniková informatika:
https://youtu.be/JW_oMOWygV8";;
57;;Študijné programy;;JO;O čom je program Informačný manažment?;Čo sa vyučuje v programe Informačný manažment?;Čo sa vyučuje v odbore Informačný manažment?;Aký je popis študíjneho programu Informačný manažment?;Aký je popis odboru Informačný manažment?;https://youtu.be/XbBZVT16bG0;;
58;;Študijné programy;;JO;O čom je program Aplikované sieťové inžinierstvo.;Čo sa vyučuje v programe Aplikované sieťové inžinierstvo?;Čo sa vyučuje v odbore Aplikované sieťové inžinierstvo?;Aký je popis študíjneho programu Aplikované sieťové inžinierstvo?;Aký je popis odboru Aplikované sieťové inžinierstvo?;https://youtu.be/_NctdDb3vK4;;
294;;Študijné programy;;JK;Kde nájdem nejaké presnejšie informácie k študijným programom na FRI?;Kde je možné nájsť detailný popis študijných programov FRI?;Kde je možné nájsť detailný popis odborov na FRI?;Ako nájdem presnejší popis študijných programov na FRI?;Ako najdem presnejší popis odborov na FRI?;https://www.fri.uniza.sk/ -> Uchádzači -> Ponúkané študijné programy;;
394;;Študijné programy;;AP;Aké študijné programy sú na FRI?;Ktoré študíjne programy sa vyučujú na FRI?;Ktoré odbory sa vyučujú na FRI?;Ktoré študíjne programy existujú na FRI?;Ktoré odbory existujú na FRI?;"Bakalárske štúdium:
Informatika, Informatika a riadenie, Informačné a sieťové technológie, Manažment, Počítačové inžinierstvo
Viac info tu: https://www.fri.uniza.sk/stranka/ponukane-bakalarske-studijne-programy
Inžinierske štúdium:
Informačné systémy, Inteligentné informačné systémy, Biomedicínska informatika, Aplikované sieťové inžinierstvo, Informačný manažment, Počítačové inžinierstvo
Viac info tu:  https://www.fri.uniza.sk/stranka/ponukane-inzinierske-studijne-programy
Doktorandské štúdium:
Aplikovaná informatika, Manažment, Inteligentné informačné systémy";;
81;;Študijný referát;;JO, AP;Aké sú úradné hodiny študíjneho referátu?;Do ktorej sú na študijnom referáte?;Kedy je možné príjsť na študíjny referát?;Aké sú úradne hodiny študíjneho referátu?;Kedy môžem navštíviť študíjne oddelenie?;"Úradné hodiny počas letných prázdnin (1.7. až 31.8.)
Pondelok až štvrtok 7:30 - 11:00 Pondelok	7:30 - 13:00 - počas vyučovania ZS+LS do 14:00 
Utorok	7:30 - 13:00
Streda	7:30 - 13:00
Štvrtok	7:30 - 13:00
Piatok	7:30 - 10:00";;
82;;Študijný referát;;JO, AP;Aký je email na študíjny referát?;Ktorý mail slúži na kontakt študíjneho referátu?;Aký je mail na študíjne oddelenie?;Akým mailom môžem kontaktovať študíjny referát?;Akým mailom môžem kontaktovať študíjne oddelenie?; studref@fri.uniza.sk, renata.novakova@fri.uniza.sk alebo maria.sicova@fri.uniza.sk;;
94;;Študijný referát;;JO;Ake je telefonné číslo na študíjny referát?;Ktoré telefónne číslo slúži na kontakt študíjneho referátu?;Aké je telefónne číslo na študíjne oddelenie?;Na ktorom telefonnom čísle môžem kontaktovač študíjny referát?;Ktorým telefónnym číslom môžem kontaktovač študíjne oddelenie?;;;
67;;Štúdium;BID;JO;Aké je hodnotenie študentov?;Ako funguje hodnotenie študentov?;Ako sa hodnotia študenti?;Aké sú hodnotenia študentov?;Čo je to hodnotenie študentov?;Hodnotenie známkou sa uskutočňuje podľa klasifikačnej stupnice, ktorú tvorí šesť klasifikačných stupňov: A (93-100), B(85-92), C(77-84), D(69-76), E(61-68), FX(<61);;
;;Erazmus;;JM;Kto si môže požiadať o erasmus?;Ako sa prihlásiť na erazmus?;Ako sa dostaťna erazmus?;Ako poslať prihlášku na erazmus?;;Odpoveď nájdete na linku = https://www.fri.uniza.sk/stranka/vseobecne-infomacie;;
;;Erazmus;;JM;Potrebujem vedieť aj iný jazyk ako anglicky ak chcem ísť na erasmus?;Je potrebné ovládať na erazme iný jazyk ako anglický?;Aký jazyk musím ovládať pre erazmus?;Aké jazyky musím vedieť ak chcem isť na erazmus?;;Odpoveď nájdete na linku = https://www.fri.uniza.sk/stranka/vseobecne-infomacie;;
;;Erazmus;;JM;Ak som študent 3. ročníka bc. Štúdia môžem ísť na Erasmus+ cez letné prazniny?;Dá sa ísť na erazmus počas letných prázdnin?;Môžem ísť na erazmus cez prázdniny?;Dá sa ísť na erazmus v lete?;;Odpoveď nájdete na linku = https://www.fri.uniza.sk/stranka/vseobecne-infomacie;;
;;Erazmus;;JM;Uznajú mi predmety počas erasmu?;Ako prebieha uznávanie predmetov na erazme?;Sú mi predmety absolvované na erazme uznané?;Rátajú sa mi kredity z erazmu?;Sú mi uznané kredity z pretmetov urobených počas erazmu?;Odpoveď nájdete na linku = https://www.fri.uniza.sk/stranka/vseobecne-infomacie;;
;;Erazmus;;JM;Aka je výška grantu na erasmus?;Koľko dostanem z grantu na erazme?;Koľko je grant na erazme?;;;Odpoveď nájdete na linku = https://www.fri.uniza.sk/stranka/vseobecne-infomacie;;
;;Erazmus;;JM;Aká je maximalná dĺžka erasmu?;Ako dlho môžem byť ne erazme?;Ako dlho trvá erazmus?;;;Odpoveď nájdete na linku = https://www.fri.uniza.sk/stranka/vseobecne-infomacie;;
